question,contexts,ground_truth,answer,bleu_score
Что делает Дозор?,"['Программный продукт «Дозор. Мониторинг систем безопасности рабочей станции» (далее – ПП) предназначен для автоматизации мониторинга состояния безопасности рабочих станций путём контроля установки и настройки антивирусной защиты, доступа к запрещенным сайтам, а также проведение сканирования и отображение информации об установленном программном обеспечении.']","«Дозор. Мониторинг систем безопасности рабочей станции» предназначен для автоматизации мониторинга состояния безопасности рабочих станций путём контроля установки и настройки антивирусной защиты, доступа к запрещенным сайтам, а также проведение сканирования и отображение информации об установленном программном обеспечении.","Программный продукт ""Дозор. Мониторинг систем безопасности рабочей станции"" предназначен для автоматизации мониторинга состояния безопасности рабочих станций путем контроля установки и настройки антивирусной защиты, ограничения доступа к запрещенным сайтам, а также проведения сканирования и отображения информации об установленном программном обеспечении.",0.568543603055242
Какие модули включает в себя продукт Дозор?,"[' \n        ПП включает в себя три модуля, обладающих следующими функциями:\n•\tМодуль проверки антивирусной защиты ПК:\no\tАвтоматическое формирование перечня установленных на рабочей станции антивирусных программ (пакетов).\no\tАвтоматическое определение и отображение каждой установленной антивирусной программы (пакета).\n•\tМодуль проверки доступа к запрещённым сайтам:\no\tПроверка наличия доступа к интернет-ресурсам, содержащим информацию, запрещённую к распространению в образовательных организациях (далее – «запрещённые интернет-ресурсы»), с текущей рабочей станции.\no\tНастройка параметров проверки:\n\uf0a7\tРасписание проверки: временные интервалы проверки в течение дня, периодичность повторных проверок.\n\uf0a7\tСкорость проверки: низкая, средняя, высокая.\n\uf0a7\tЗадержка между проверками сайтов (в секундах).\no\tЕсли проверка была прервана (например, рабочая станция была выключена до окончания проверки доступности всех интернет-ресурсов из списка), при следующем запуске проверка возобновляется с той позиции в списке, на которой был прерван предыдущий сеанс.\no\tФормирование отчётности о результатах проверки доступа к запрещённым интернет-ресурсам: \n\uf0a7\tСводный отчёт - включает информацию об общем количестве ресурсов в перечне, количестве проверенных ресурсов и количестве доступных интернет-ресурсов из перечня.\n\uf0a7\tДетализированный отчёт – включает перечень всех запрещённых интернет-ресурсов. Для каждого ресурса выводится его доменное имя, дата и время проверки, результат проверки (доступен или не доступен).\no\tСохранение детализированного отчёта в файл в формате CSV.\no\tАвтоматическое обновление перечня запрещённых интернет-ресурсов.\n•\tМодуль проверки программного обеспечения (далее - ПО) на доверие: \no\tПоиск и отображение установленного ПО на ПК пользователя и неизвестного информационной базе ПП.\no\tОтображение пользователю списка, установленного ПО на персональном компьютере пользователя, с известной информацией о них с базы ПП.\no\tВозможность отправки скорректированной записи ПО на рассмотрение оператору по внесению изменений в запись.\no\tВозможность сортировки списков: \n\uf0a7\tПо наименованию ПО.\n\uf0a7\tПо доверию.\no\tОтображение информации о версии используемой информационной базы ПП.\no\tВыгрузка отчетности по ПО, установленному на персональном компьютере пользователя, в формате CSV.\no\tАвтоматизированная загрузка с сервера актуальной базы ПО.\no\tПредоставление вместе с ПП списка базового ПО с дополнительной информацией по программным средствам (может использоваться при запуске программы без Интернет-соединения).\no\tВозможность сокрытия модулей программы через Настройки. \n\u2003\n']","Модуль проверки антивирусной защиты ПК, модуль проверки доступа к запрещённым сайтам,  модуль проверки программного обеспечения (далее - ПО) на доверие","Продукт ""Дозор"" включает в себя три модуля: модуль проверки антивирусной защиты ПК, модуль проверки доступа к запрещенным сайтам и модуль проверки программного обеспечения.",0.3576064815303364
Хватит 4 гб оперативки для использования продука Дозор?,"['\n    2\tТехнические требования\nОперационная система\nWindows, поддерживающая .NET 5: \n•\tWindows 10\n\nLinux, поддерживающая .NET 5: \n•\tAlt Linux Рабочая станция 9\n•\tAlt Linux Рабочая станция 10\n•\tAlt Linux Образование 9\n•\tAlt Linux Образование 10\n•\tASTRA LINUX COMMON EDITION РЕЛИЗ «ОРЕЛ»\nПроцессор: \nот 1 ГГц\nОперативная память\nРекомендуемый объём ОЗУ: 8 Гб.\nЖесткий диск\nдля установки и работы ПП требуется наличие свободного места размером не менее 300 МБ на диске.\nНаличие доступа в Интернет:\nДля обновления информационных баз, используемых ПП, и их последующей проверки требуется интернет-соединение со скоростью от 64 Кбит/сек.\nДля установки и настройки ПП компьютер должен быть оснащён манипулятором «мышь».\n\n    ']",Нет. Для работы программного продукат дозор рекомендуется использовать минимум 8Гб ОЗУ. ,"Да, 4 Гб оперативной памяти хватит для использования продукта Дозор.",0.0
Сколько весит Дозор?,"['\n    2\tТехнические требования\nОперационная система\nWindows, поддерживающая .NET 5: \n•\tWindows 10\n\nLinux, поддерживающая .NET 5: \n•\tAlt Linux Рабочая станция 9\n•\tAlt Linux Рабочая станция 10\n•\tAlt Linux Образование 9\n•\tAlt Linux Образование 10\n•\tASTRA LINUX COMMON EDITION РЕЛИЗ «ОРЕЛ»\nПроцессор: \nот 1 ГГц\nОперативная память\nРекомендуемый объём ОЗУ: 8 Гб.\nЖесткий диск\nдля установки и работы ПП требуется наличие свободного места размером не менее 300 МБ на диске.\nНаличие доступа в Интернет:\nДля обновления информационных баз, используемых ПП, и их последующей проверки требуется интернет-соединение со скоростью от 64 Кбит/сек.\nДля установки и настройки ПП компьютер должен быть оснащён манипулятором «мышь».\n\n    ']",Для установки и работы ПП Дозор требуется наличие свободного места размером не менее 300 МБ на диске.,Из предоставленного контекста невозможно определить вес Дозора.,0.0
Почему не обновляются информационные базы в  Дозор?,"['\n    2\tТехнические требования\nОперационная система\nWindows, поддерживающая .NET 5: \n•\tWindows 10\n\nLinux, поддерживающая .NET 5: \n•\tAlt Linux Рабочая станция 9\n•\tAlt Linux Рабочая станция 10\n•\tAlt Linux Образование 9\n•\tAlt Linux Образование 10\n•\tASTRA LINUX COMMON EDITION РЕЛИЗ «ОРЕЛ»\nПроцессор: \nот 1 ГГц\nОперативная память\nРекомендуемый объём ОЗУ: 8 Гб.\nЖесткий диск\nдля установки и работы ПП требуется наличие свободного места размером не менее 300 МБ на диске.\nНаличие доступа в Интернет:\nДля обновления информационных баз, используемых ПП, и их последующей проверки требуется интернет-соединение со скоростью от 64 Кбит/сек.\nДля установки и настройки ПП компьютер должен быть оснащён манипулятором «мышь».\n\n    ']","Для обновления информационных баз, используемых ПП, и их последующей проверки требуется интернет-соединение со скоростью от 64 Кбит/сек.","Из предоставленного контекста не ясно, почему не обновляются информационные базы в ""Дозор"".",0.0
Как установить дозор на macos?,"['\n    2\tТехнические требования\nОперационная система\nWindows, поддерживающая .NET 5: \n•\tWindows 10\n\nLinux, поддерживающая .NET 5: \n•\tAlt Linux Рабочая станция 9\n•\tAlt Linux Рабочая станция 10\n•\tAlt Linux Образование 9\n•\tAlt Linux Образование 10\n•\tASTRA LINUX COMMON EDITION РЕЛИЗ «ОРЕЛ»\nПроцессор: \nот 1 ГГц\nОперативная память\nРекомендуемый объём ОЗУ: 8 Гб.\nЖесткий диск\nдля установки и работы ПП требуется наличие свободного места размером не менее 300 МБ на диске.\nНаличие доступа в Интернет:\nДля обновления информационных баз, используемых ПП, и их последующей проверки требуется интернет-соединение со скоростью от 64 Кбит/сек.\nДля установки и настройки ПП компьютер должен быть оснащён манипулятором «мышь».\n\n    ']","К сожалению вы не сможете установить ПП Дозор на устройство с оп MacOS, поддерживаемые опреационные системы: 
        Операционная система Windows, поддерживающая .NET 5: 
            •	Windows 10

        Linux, поддерживающая .NET 5: 
        •	Alt Linux Рабочая станция 9
        •	Alt Linux Рабочая станция 10
        •	Alt Linux Образование 9
        •	Alt Linux Образование 10
        •	ASTRA LINUX COMMON EDITION РЕЛИЗ «ОРЕЛ»
        ","Из предоставленного контекста невозможно определить, как установить дозор на macOS.",7.850707993042515e-232
Программ дозор лагает !,"['\n    2\tТехнические требования\nОперационная система\nWindows, поддерживающая .NET 5: \n•\tWindows 10\n\nLinux, поддерживающая .NET 5: \n•\tAlt Linux Рабочая станция 9\n•\tAlt Linux Рабочая станция 10\n•\tAlt Linux Образование 9\n•\tAlt Linux Образование 10\n•\tASTRA LINUX COMMON EDITION РЕЛИЗ «ОРЕЛ»\nПроцессор: \nот 1 ГГц\nОперативная память\nРекомендуемый объём ОЗУ: 8 Гб.\nЖесткий диск\nдля установки и работы ПП требуется наличие свободного места размером не менее 300 МБ на диске.\nНаличие доступа в Интернет:\nДля обновления информационных баз, используемых ПП, и их последующей проверки требуется интернет-соединение со скоростью от 64 Кбит/сек.\nДля установки и настройки ПП компьютер должен быть оснащён манипулятором «мышь».\n\n    ']","
        Возможно это связано недостаточностью ресурсов устройства на которой установлена программа. 
        Убедитесь что ваше устройство соответвует техническим требованиям:
        
        Процессор -   от 1 ГГц
        Оперативная памят -  Рекомендуемый объём ОЗУ: 8 Гб.
        Жесткий диск - наличие свободного места размером не менее 300 МБ на диске.
        Наличие доступа в Интернет -  для обновления информационных баз, используемых ПП, и их последующей проверки. 
        ","Из предоставленного контекста не ясно, что именно вызывает лаги в программе ""Дозор. Мониторинг систем безопасности рабочей станции"". Если у вас возникли проблемы с работой программы, рекомендуется обратиться к разработчикам или технической поддержке для получения помощи и решения проблемы.",9.871742677130652e-232
Что я получу после оплаты продукта дозор?,['\n                ПП поставляется в электронном виде и включает в себя следующий набор файлов:\n                    •\tDozor_setup_1.0.0.0.exe  – установщик ПП.\n                    •\tРуководство пользователя (данный документ).\n                Электронная почта для вопросов по продукту: info@cr-obr.ru. \n        '],"
                ПП поставляется в электронном виде и включает в себя следующий набор файлов:
                    •	Dozor_setup_1.0.0.0.exe  – установщик ПП.
                    •	Руководство пользователя (данный документ).
                Также вы можете получить консульатцию - Электронная почта для вопросов по продукту: info@cr-obr.ru. 
        ","После оплаты продукта ""Дозор. Мониторинг систем безопасности рабочей станции"" вы получите доступ к программному обеспечению, которое поможет автоматизировать мониторинг состояния безопасности рабочих станций путем контроля установки и настройки антивирусной защиты, ограничения доступа к запрещенным сайтам, а также проведения сканирования и отображения информации об установленном программном обеспечении.",6.505134192625612e-232
Что я получу после оплаты продукта дозор?,['\n                ПП поставляется в электронном виде и включает в себя следующий набор файлов:\n                    •\tDozor_setup_1.0.0.0.exe  – установщик ПП.\n                    •\tРуководство пользователя (данный документ).\n                Электронная почта для вопросов по продукту: info@cr-obr.ru. \n        '],"
                ПП поставляется в электронном виде и включает в себя следующий набор файлов:
                    •	Dozor_setup_1.0.0.0.exe  – установщик ПП.
                    •	Руководство пользователя (данный документ).
                Также вы можете получить консульатцию - Электронная почта для вопросов по продукту: info@cr-obr.ru. 
        ","После оплаты продукта ""Дозор. Мониторинг систем безопасности рабочей станции"" вы получите доступ к программному обеспечению, которое поможет автоматизировать мониторинг состояния безопасности рабочих станций путем контроля установки и настройки антивирусной защиты, ограничения доступа к запрещенным сайтам, а также проведения сканирования и отображения информации об установленном программном обеспечении.",6.505134192625612e-232
Что такое медленные режим проверки в  дозор?,"['\n            При первом запуске программы на каждом компьютере необходимо настроить параметры и расписание проверки. В дальнейшем эти параметры можно изменять только в случае необходимости. \n            Для настройки параметров необходимо в главном окне программы нажать «Настройки». После чего откроется окно настроек.\n            В окне настроек необходимо выбрать один из режимов проверки (по умолчанию - медленный):\n            •\tМедленный – проверка сайтов будет происходить поочередно, время проверки увеличится, нагрузка на сеть и компьютер уменьшится.\n            •\tОбычный – проверка будет происходить по нескольким сайтам одновременно (кол-во одновременно проверяемых сайтов зависит от количества физических ядер процессора), время проверки уменьшится, нагрузка на сеть и компьютер увеличится.\n            •\tБыстрый – проверка будет происходить по нескольким сайтам одновременно (кол-во одновременно проверяемых сайтов равно количеству ядер процессора, умноженному на 4), время проверки уменьшится, нагрузка на сеть и компьютер увеличится.\n\n        ']","
                Медленный режим означает, что проверка сайтов будет происходить поочередно, время проверки увеличится, нагрузка на сеть и компьютер уменьшится.
        ","Медленный режим проверки в Дозоре - это режим, при котором проверка сайтов происходит поочередно, время проверки увеличивается, а нагрузка на сеть и компьютер уменьшается.",0.22913546356478914
Что такое обычный  режим проверки в  дозор?,"['\n            При первом запуске программы на каждом компьютере необходимо настроить параметры и расписание проверки. В дальнейшем эти параметры можно изменять только в случае необходимости. \n            Для настройки параметров необходимо в главном окне программы нажать «Настройки». После чего откроется окно настроек.\n            В окне настроек необходимо выбрать один из режимов проверки (по умолчанию - медленный):\n            •\tМедленный – проверка сайтов будет происходить поочередно, время проверки увеличится, нагрузка на сеть и компьютер уменьшится.\n            •\tОбычный – проверка будет происходить по нескольким сайтам одновременно (кол-во одновременно проверяемых сайтов зависит от количества физических ядер процессора), время проверки уменьшится, нагрузка на сеть и компьютер увеличится.\n            •\tБыстрый – проверка будет происходить по нескольким сайтам одновременно (кол-во одновременно проверяемых сайтов равно количеству ядер процессора, умноженному на 4), время проверки уменьшится, нагрузка на сеть и компьютер увеличится.\n\n        ']","
                •	Обычный – проверка будет происходить по нескольким сайтам одновременно (кол-во одновременно проверяемых сайтов зависит от количества физических ядер процессора), время проверки уменьшится, нагрузка на сеть и компьютер увеличится.
        ","Обычный режим проверки в Дозоре - это режим, при котором проверка сайтов происходит одновременно по нескольким сайтам, что уменьшает время проверки, но увеличивает нагрузку на сеть и компьютер.",2.405662201447081e-78
Чем медленный режим отличается от быстрого? В дозор? ,"['\n            При первом запуске программы на каждом компьютере необходимо настроить параметры и расписание проверки. В дальнейшем эти параметры можно изменять только в случае необходимости. \n            Для настройки параметров необходимо в главном окне программы нажать «Настройки». После чего откроется окно настроек.\n            В окне настроек необходимо выбрать один из режимов проверки (по умолчанию - медленный):\n            •\tМедленный – проверка сайтов будет происходить поочередно, время проверки увеличится, нагрузка на сеть и компьютер уменьшится.\n            •\tОбычный – проверка будет происходить по нескольким сайтам одновременно (кол-во одновременно проверяемых сайтов зависит от количества физических ядер процессора), время проверки уменьшится, нагрузка на сеть и компьютер увеличится.\n            •\tБыстрый – проверка будет происходить по нескольким сайтам одновременно (кол-во одновременно проверяемых сайтов равно количеству ядер процессора, умноженному на 4), время проверки уменьшится, нагрузка на сеть и компьютер увеличится.\n\n        ']","
               При медленном режиме – проверка сайтов будет происходить поочередно, время проверки увеличится, нагрузка на сеть и компьютер уменьшится,
               В обычном режиме проверка будет происходить по нескольким сайтам одновременно это уменьшит время проверки, но увлеичит нагрузку на сеть компьютера.
        ","Медленный режим отличается от быстрого тем, что проверка сайтов происходит поочередно, время проверки увеличивается, нагрузка на сеть и компьютер уменьшается. Обычный режим предполагает проверку нескольких сайтов одновременно, время проверки уменьшается, нагрузка на сеть и компьютер увеличивается. Быстрый режим также предполагает проверку нескольких сайтов одновременно, но количество одновременно проверяемых сайтов равно количеству ядер процессора, умноженному на 4.",0.09500804968073263
Почему при быстром режиме проверки в дозор возрастает нагрузка на сервер?,"['\n            При первом запуске программы на каждом компьютере необходимо настроить параметры и расписание проверки. В дальнейшем эти параметры можно изменять только в случае необходимости. \n            Для настройки параметров необходимо в главном окне программы нажать «Настройки». После чего откроется окно настроек.\n            В окне настроек необходимо выбрать один из режимов проверки (по умолчанию - медленный):\n            •\tМедленный – проверка сайтов будет происходить поочередно, время проверки увеличится, нагрузка на сеть и компьютер уменьшится.\n            •\tОбычный – проверка будет происходить по нескольким сайтам одновременно (кол-во одновременно проверяемых сайтов зависит от количества физических ядер процессора), время проверки уменьшится, нагрузка на сеть и компьютер увеличится.\n            •\tБыстрый – проверка будет происходить по нескольким сайтам одновременно (кол-во одновременно проверяемых сайтов равно количеству ядер процессора, умноженному на 4), время проверки уменьшится, нагрузка на сеть и компьютер увеличится.\n\n        ']","
               	Быстрый – проверка будет происходить по нескольким сайтам одновременно (кол-во одновременно проверяемых сайтов равно количеству ядер процессора, умноженному на 4), время проверки уменьшится, нагрузка на сеть и компьютер увеличится.
                Если хотите уменьшить нагрузку на сеть, выберете обычный или медленный режим.
        ","При быстром режиме проверки в дозоре возрастает нагрузка на сервер, потому что проверка происходит по нескольким сайтам одновременно, что увеличивает нагрузку на сеть и компьютер.",2.653093416342827e-78
Какие параметры настройки  проверки проверки доступа к запрещённым сайтам есть в Дозор ?,"['\n            o\tПроверка наличия доступа к интернет-ресурсам, содержащим информацию, запрещённую к распространению в образовательных организациях (далее – «запрещённые интернет-ресурсы»), с текущей рабочей станции.\n            o\tНастройка параметров проверки:\n            \uf0a7\tРасписание проверки: временные интервалы проверки в течение дня, периодичность повторных проверок.\n            \uf0a7\tСкорость проверки: низкая, средняя, высокая.\n            \uf0a7\tЗадержка между проверками сайтов (в секундах).\n            o\tЕсли проверка была прервана (например, рабочая станция была выключена до окончания проверки доступности всех интернет-ресурсов из списка), при следующем запуске проверка возобновляется с той позиции в списке, на которой был прерван предыдущий сеанс.\n        ']","
        Вы можете настраивать Расписание проверки, Скорость проверки: низкая, средняя, высокая. Задержку между проверками сайтов (в секундах).
        ","В Дозоре есть следующие параметры настройки проверки доступа к запрещённым сайтам: расписание проверки, скорость проверки, задержка между проверками сайтов.",4.134942775307825e-155
"У меня прервалась проверка запрещенных сайтов в дозор, как мне восстановить работу ?","['\n            o\tЕсли проверка была прервана (например, рабочая станция была выключена до окончания проверки доступности всех интернет-ресурсов из списка), при следующем запуске проверка возобновляется с той позиции в списке, на которой был прерван предыдущий сеанс.\n        ']","
        Просто запустите проверку повторно. При следующем запуске проверка возобновляется с той позиции в списке, на которой был прерван предыдущий сеанс.
        ","Если проверка была прервана (например, рабочая станция была выключена до окончания проверки доступности всех интернет-ресурсов из списка), при следующем запуске проверка возобновляется с той позиции в списке, на которой был прерван предыдущий сеанс.",0.3803367615257741
 Я смогу выгружать отчет по пользователю в Дозор?,"['\n            •\tМодуль проверки ПО на доверие: \n            o\tВыгрузка отчетности по ПО, установленному на персональном компьютере пользователя, в формате CSV.\n        ']","
        Да! Вы можете выгружать отчетности по ПО, установленному на персональном компьютере пользователя, в формате CSV
        ","Да, вы сможете выгружать отчет по пользователю в Дозор.",1.2183324802375697e-231
 Как посмотреть в дозор колчество недоступных сайтов ?,"['\n            •\tВо вкладке «Запрещенные сайты» (рисунок 9) предоставляется информация о проверке запрещённых сайтов. Отображаются показатели:\n                o\tОбщее количество сайтов в списке.\n                o\tКоличество сайтов из списка, проверенных в текущем сеансе проверки.\n                o\tКоличество сайтов, проверенных в текущем сеансе и определённых как недоступные.\n                o\tПроцент недоступных сайтов из общего количества сайтов, проверенных в текущем сеансе.\n\n        ']","
        Во вкладке «Запрещенные сайты» (рисунок 9) предоставляется информация о проверке запрещённых сайтов.  В том числе информаци о 
        Количестве сайтов, проверенных в текущем сеансе и определённых как недоступные.
        ","Чтобы посмотреть количество недоступных сайтов, вам нужно перейти во вкладку ""Запрещенные сайты"" и обратить внимание на столбец ""Количество сайтов, проверенных в текущем сеансе и определённых как недоступные"". Это число будет указывать на количество недоступных сайтов из общего количества сайтов, проверенных в текущем сеансе.",0.13894583621580456
 Где в дозор посмотреть список неизветного ПО устновленного на ПК?,"['\n            •\tВкладка «Программное обеспечение» (рисунок 10) предоставляет информацию по проверке ПО, установленного на рабочей станции. Проверка происходит путем сверки ПО клиента и информационной базой ПО, предоставляемой пользователю с ПП. Модуль предоставляет следующую информацию о ПО:\n            o\tСписок неизвестного ПО, установленного на ПК.\n\n        ']","
        Вкладка  «Программное обеспечение» редоставляет информацию по проверке ПО, установленного на рабочей станции. Проверка происходит путем сверки ПО клиента и информационной базой ПО, предоставляемой пользователю с ПП. 
        ","Список неизвестного ПО, установленного на ПК, можно посмотреть в программе ""Дозор. Мониторинг систем безопасности рабочей станции"".",1.8379236026302172e-78
 Как установить Дозор ?,['\n           Дистрибутив ПП представляет собой файл:\n            •\tДля Linux: Dozor.1.0.0.rpm (для Alt Linux) или Dozor.1.0.0.deb (для Astra Linux) инсталляционный пакет ПП. \n            •\tДля Windows: Dozor_setup_1.0.0.0.exe - инсталляционный пакет ПП. \n            Вместо фрагмента «1.0.0.0» могут стоять другие цифры — они соответствуют номеру релиза ПП.\n            Порядок установки:\n            1.\tЗапустить инсталляционный пакет ПП. При запуске произойдёт стандартный запрос прав администратора. \n\n        '],"
        Запустить инсталляционный пакет ПП. 
        Для Linux: Dozor.1.0.0.rpm (для Alt Linux) или Dozor.1.0.0.deb (для Astra Linux) инсталляционный пакет ПП.
        Для Windows: Dozor_setup_1.0.0.0.exe - инсталляционный пакет ПП. 
        Вместо фрагмента «1.0.0.0» могут стоять другие цифры — они соответствуют номеру релиза ПП.
        
        При запуске произойдёт стандартный запрос прав администратора. 
        ","Для установки программного продукта ""Дозор. Мониторинг систем безопасности рабочей станции"" необходимо выполнить следующие шаги:

1. Загрузите установщик ПП - Dozor_setup_1.0.0.0.exe.
2. Откройте установщик и следуйте инструкциям на экране.
3. После завершения установки, запустите программу ""Дозор. Мониторинг систем безопасности рабочей станции"".

Обратите внимание, что для работы программы требуется наличие прав администратора на компьютере.",7.923710309822816e-232
 Как активировать лицензию Дозор ?,"['\n       1.1\tЗапуск и активация программного продукта на Windows\n        После установки ПП на компьютер – рабочую станцию, необходимо запустить ПП.\n        Запуск ПП осуществляется с помощью файла запуска:\n        После запуска отобразится окно с модулями программы и рабочими данными в них, при условии, что уже был указан путь к действительной лицензии ПП. В ином случае необходимо выполнить активацию ПП, указав путь к файлу с действительной лицензией. \n        Активация выполняется в окне «Настройки», переход в которое осуществляется из главного окна ПП (рисунок 5).\n        При нажатии кнопки «Настройки» откроется окно «Настройки» (рисунок 6).\n        В окне «Настройки» необходимо перейти на вкладку «Активация» и нажать кнопку «Открыть» (рисунок 7).\n        После нажатия кнопки «Открыть», откроется окно выбора файла (рисунок 8), здесь необходимо выбрать файл-лицензию, выданную продавцом. \n        При соблюдении всех шагов данной инструкции, активация завершится успешно, и вы сможете приступить к работе. \n\n        ']","
        1. После установки ПП на компьютер – рабочую станцию, необходимо запустить ПП.
        2. После запуска отобразится окно с модулями программы и рабочими данными в них, при условии, что уже был указан путь к действительной лицензии ПП. В ином случае необходимо выполнить активацию ПП, указав путь к файлу с действительной лицензией. 
        
        Как указать путь к лиценции:
        1. Перейдите в окно «Настройки», переход в которое осуществляется из главного окна ПП. 
        2. В окне «Настройки» необходимо перейти на вкладку «Активация» и нажать кнопку «Открыть» 
        3. После нажатия кнопки «Открыть», откроется окно выбора файла (рисунок 8), здесь необходимо выбрать файл-лицензию, выданную продавцом. 
        При соблюдении всех шагов данной инструкции, активация завершится успешно, и вы сможете приступить к работе. 
        ","Для активации лицензии Дозор необходимо выполнить следующие шаги:

1. Перейти в окно ""Настройки"" и нажать кнопку ""Открыть"".
2. После нажатия кнопки ""Открыть"", откроется окно выбора файла. Здесь необходимо выбрать файл-лицензию, выданную продавцом.
3. При соблюдении всех шагов данной инструкции, активация завершится успешно, и вы сможете приступить к работе.",0.20363796514307056
"что такое сзд, в скан-архив",['\n        •\t«Скан-Загрузка документов» (СЗД) — программный продукт «Скан-Загрузка документов».\n                    '],"
             СЗД - программный продукт «Скан-Загрузка документов».
        ","""СЗД"" в контексте данного текста является аббревиатурой программного продукта ""Скан-Загрузка документов"".",0.0
"что такое БРС, в скан-архив","['\n        •\tБаза регистрации сканов (БРС) — информационная база 1С, предназначенная для хранения информации об обработанных сканах. Используется в случае если СЗД работает без СА, и есть необходимость хранить обработанные сканы с привязкой к созданным документам\n                    ']","
             БРС - информационная база 1С, предназначенная для хранения информации об обработанных сканах. Используется в случае если СЗД работает без СА, и есть необходимость хранить обработанные сканы с привязкой к созданным документам
        ","База регистрации сканов (БРС) - это информационная база 1С, предназначенная для хранения информации об обработанных сканах. Она используется в случае, если система электронного документооборота (СЗД) работает без интеграции с ""Скан-Архивом"" и требуется хранить обработанные сканы с привязкой к созданным документам.",0.3843268486339367
"Нужно ли покупать несколько лицензий для разных рабочих мест , в скан-архив ","['\n        \n       Для работы в терминальном режиме с N рабочих мест, также необходимо приобрести N лицензий на рабочие места.\n       Приобретаемая лицензия не накладывает ограничений на режим работы с СЗД. Например, вы можете установить и активировать СЗД для работы в локальном режиме, а затем выполнить переактивацию и перенести СЗД на другое рабочее место для работы в локальном или терминальном режиме. В пределах срока действия лицензии вы можете переносить СЗД с одного рабочего места на другое рабочее место (с изменением или с сохранением режима работы) неограниченное число раз, при этом:\n\n        •\tПри таком переносе вы теряете право использования СЗД на старом рабочем месте.\n        •\tПроцедура переноса требует деактивации СЗД на старом рабочем месте и активации на новом.\n        \n        •\tПеренос лицензии на новое рабочее место возможен не ранее чем через 3 рабочих дня после активации на предыдущем рабочем месте.\n        Порядок действий при активации «Скан-Загрузки документов» для разных вариантов лицензирования описан в настоящем «Руководстве» в параграфе «Активация программных компонент» на стр. 15.\n\n                    ']","
        Для работы в терминальном режиме с N рабочих мест, также необходимо приобрести N лицензий на рабочие места.
        ","Да, если вы хотите использовать ""Скан-Загрузку документов"" на нескольких компьютерах, вам потребуется приобрести и активировать соответствующее количество лицензий.",1.006020563316025e-231
как установть скан-архив в  меню «Сервис» ,"['\n        Запуск обработки пользователем выполняется стандартным способом, через список дополнительных отчётов:\n\n        •\tВ обычном режиме – через меню «Сервис» / «Дополнительные отчеты и обработки» /\n        «Дополнительные внешние обработки».\n        \n        •\tВ управляемом режиме — через команду «Дополнительные отчёты» в подразделе «Отчеты» в тех разделах, в которых администратор разместил отчёт. При первом запуске необходимо нажать гиперссылку «Настроить список» в нижней части окна со списком дополнительных отчётов и добавить отчёт «Подсчет количества документов» в список».\n\n        ']","
        Запуск обработки пользователем выполняется стандартным способом, через список дополнительных отчётов:

        •	В обычном режиме – через меню «Сервис» / «Дополнительные отчеты и обработки» /
        «Дополнительные внешние обработки».

        ","Из предоставленного контекста не ясно, как установить скан-архив в меню ""Сервис"".",7.992219124248642e-232
Что означает не исправлять суммы при распознавании в скан архив. ,['\n        Флажок «Не исправлять суммы при распознавании» отключает выполняемый по умолчанию автоматический пересчёт сумм в документе при обработка отсканированного документа. Подробнее см. в «Проверка и дополнение данных» \n        '],"
        Флажок «Не исправлять суммы при распознавании» отключает выполняемый по умолчанию автоматический пересчёт сумм в документе при обработка отсканированного документа.

        ","Флажок ""Не исправлять суммы при распознавании"" отключает автоматический пересчет сумм в документе при обработке отсканированного документа. Это означает, что если этот флажок установлен, то программа не будет автоматически пересчитывать числовые значения в документе, такие как итоговые суммы, цены, количество товаров и услуг. Вместо этого, данные будут переноситься ""как есть"", без автоматического пересчета.",0.03865126773178273
Как не учитывать НДС при создании документа в скан-архив. ,"['\n       •\tФлажок «Не учитывать НДС при создании документа» устанавливает режим, при котором в загружаемых документах по умолчанию устанавливается режим учёта без НДС. Этот режим удобен для организаций, работающих без НДС, чьи поставщики предоставляют документы с НДС.\n        ']","
        Для настройки параметров надо в форме обработки нажать «Настройки» в верхнем правом углу обработки и выбрать пункт меню «Настройка параметров обработки»
        Флажок «Не исправлять суммы при распознавании» отключает выполняемый по умолчанию автоматический пересчёт сумм в документе при обработка отсканированного документа.

        ","Для того чтобы не учитывать НДС при создании документа в скан-архив, необходимо приобрести и внедрить отдельный программный продукт - ""Скан-Архив"". Этот программный продукт предназначен для автоматизации создания и использования электронного архива скан-копий печатных документов. Он может быть интегрирован с СЗД для хранения обработанных сканов с привязкой к созданным в базе документам.",8.228200092664088e-232
"У нас разные компании используют разные печатные формы для одних и тех же документов, как это обработать  в скан-архив. ","['\n                4.2\tНастройка правил распознавания\n                Перед началом работы необходимо настроить правила распознавания и обработки сканов, или загрузить уже готовые правила. Эти правила применяются как для загрузки данных из скан-образов (сканированные документы), так и для загрузки данных из табличных документов (формат Excel, OpenDocument, mxl).\n                \n                В поставку СЗД входит файл «ПравилаОбработки.xml», содержащий правила обработки типовых печатных форм «ТОРГ-12», «Счет-фактура» и «Универсальный передаточный документ». Для загрузки готовых правил необходимо нажать кнопку «…» в поле «Правила обработки» и выбрать файл xml, содержащий описание правил.\n\n                Для создания новых правил или изменения существующих правил в подменю «Настройки» выберите пункт меню «Настройка параметров обработки» (см. также следующий параграф).\n\n                Откроется форма для настройки правил. Если файл с правилами не указан, откроется пустая форма (Рис. 21), иначе — форма со списком печатных форм и правил их обработки (Рис. 22).\n\n                \n                Рис. 21\t \n                Рис. 22\n\n                Обратите внимание, что список печатных форм – иерархический, имеет два уровня (Рис. 23). На первом уровне находится название печатной формы – например, «ТОРГ-12». Второй уровень соответствует различным вариантам печатной формы. Такое разделение связано с тем, что одна и та же (с точки зрения учёта) печатная форма у разных организаций (или даже у одной организации, но по различным видам деятельности) может существовать в отличающихся форматах (альбомная или книжная ориентация, разное расположение информационных полей и т.п.). Поэтому распознавание для разных вариантов одной и той же печатной формы может потребовать различных настроек. Правила обработки задаются именно для вариантов печатной формы.\n\n                Для добавления правил обработки   нового типа   печатных   форм   необходимо   нажать кнопку\n                «Добавить».\n\n                Для изменения правил обработки уже имеющейся в списке печатной формы необходимо выбрать в списке нужный вариант печатной формы (т.е. элемент на втором уровне иерархии) и дважды щёлкнуть на нему мышью (Рис. 23).\n\n        ']","
        1. Для создания новых правил или изменения существующих правил в подменю «Настройки» выберите пункт меню «Настройка параметров обработки» 
        2. Откроется форма для настройки правил. Если файл с правилами не указан, откроется пустая форма (Рис. 21), иначе — форма со списком печатных форм и правил их обработки.
        список печатных форм – иерархический, имеет два уровня. На первом уровне находится название печатной формы – например, «ТОРГ-12». Второй уровень соответствует различным вариантам печатной формы. Такое разделение связано с тем, что одна и та же (с точки зрения учёта) печатная форма у разных организаций (или даже у одной организации, но по различным видам деятельности) может существовать в отличающихся форматах (альбомная или книжная ориентация, разное расположение информационных полей и т.п.). Поэтому распознавание для разных вариантов одной и той же печатной формы может потребовать различных настроек. Правила обработки задаются именно для вариантов печатной формы.
        3. Для добавления правил обработки   нового типа   печатных   форм   необходимо   нажать кнопку
        «Добавить».

        ","Для обработки разных компаний, использующих разные печатные формы для одних и тех же документов, в Скан-Архиве можно использовать алгоритм объединения вариантов печатных форм. Этот алгоритм позволяет объединять несколько настроенных пользователем вариантов печатных форм, таких как ""УПД_ООО_Огонек"", ""УПД2"", ""УПД_КонтрагентN"", если они удовлетворяют определенным условиям. Объединение возможно для областей поиска, имеющих одинаковые названия реквизитов или областей поиска, которые могут пересекаться при объединении. Однако, объединение не применимо, если реквизиты поиска имеют различное название или регистр. Для повышения качества распознавания рекомендуется время от времени выполнять объединение вариантов печатных форм.",1.0850568348973216e-231
Что за файлы лежат в папке с программой  в скан-архив. ,"['\n            Поставка программы «Скан-Загрузка документов» включает в себя:\n                    •\tВнешние обработки для «1С:Предприятия 8».\n                    o\tСканЗагрузка.epf — основная обработка СЗД.\n                    o\tСканЗагрузка_Фреш.epf — версия обработки для работы в модели сервиса (Фреш).\n                    o\tБРС_ПросмотрСканОбраза.epf — обработка для просмотра сканов, прикреплённых к конкретному документу в базе. Используется при применении режима сохранения обработанных сканов в БРС (см. параграф «6.2.5 Просмотр прикреплённых сканов»).\n                    o\tСЗД_ЖурналОтсканированныхДокументов.epf — обработка для отображения журнала документов с пометками тех, для которых есть прикреплённые сканы. Используется при применении режима сохранения обработанных сканов в БРС (см. параграф «6.2.6 Просмотр журнала документов»).\n                    •\tБРС.dt — выгрузка базы регистрации сканов (БРС). Используется при применении режима сохранения обработанных сканов в БРС (см. параграф «6.2 Сохранение сканов в БРС»).\n                    •\tПрограммные компоненты.\n                    •\tДанное руководство пользователя.\n                    •\tФайл «ПравилаОбработки.xml» с настройками правил обработки типовых регламентированных форм (ТОРГ-12, счёт-фактура, УПД).\n                    •\tПримеры файлов для загрузки (сканы и файлы в табличном формате MS Excel и Open Office / Libre Office).\n        ']","
        Поставляются файлы:
                    •	Внешние обработки для «1С:Предприятия 8».
                        o	СканЗагрузка.epf — основная обработка СЗД.
                        o	СканЗагрузка_Фреш.epf — версия обработки для работы в модели сервиса (Фреш).
                        o	БРС_ПросмотрСканОбраза.epf — обработка для просмотра сканов, прикреплённых к конкретному документу в базе. Используется при применении режима сохранения обработанных сканов в БРС (см. параграф «6.2.5 Просмотр прикреплённых сканов»).
                        o	СЗД_ЖурналОтсканированныхДокументов.epf — обработка для отображения журнала документов с пометками тех, для которых есть прикреплённые сканы. Используется при применении режима сохранения обработанных сканов в БРС (см. параграф «6.2.6 Просмотр журнала документов»).
                    •	БРС.dt — выгрузка базы регистрации сканов (БРС). Используется при применении режима сохранения обработанных сканов в БРС (см. параграф «6.2 Сохранение сканов в БРС»).
                    •	Программные компоненты.
                    •	Данное руководство пользователя.
                    •	Файл «ПравилаОбработки.xml» с настройками правил обработки типовых регламентированных форм (ТОРГ-12, счёт-фактура, УПД).
                    •	Примеры файлов для загрузки (сканы и файлы в табличном формате MS Excel и Open Office / Libre Office).

        ","Из предоставленного контекста нельзя однозначно определить, какие файлы лежат в папке с программой ""Хранитель V"" в скан-архиве. Однако, можно сказать, что программа ""Хранитель V"" позволяет сохранять обработанные сканы в отдельной папке или ресурсе FTP. Также, существует возможность создания специального программного продукта - ""Скан-Архив"", который предназначен для хранения сканов.",8.18873472774142e-232
Я смогу запустить скан-архив на linux ?,"['\n            Операционная система\n            На компьютере, на котором планируется работа по сканированию и загрузке документов, должна быть установлена операционная система Windows, поддерживающая .NET Framework 4.5: Windows 7 Service Pack 1; Windows Vista Service Pack 2, Windows 8, Windows 8.1, Windows Server 2008 SP2, Windows Server 2012. Полный перечень технически требований, предъявляемых платформой .NET Framework 4.5, приведён на странице Microsoft:\n            http://www.microsoft.com/ru-RU/download/details.aspx?id=30653\n\n            СЗД позволяет работать с базой в режиме удалённого подключения (Remote Desktop). Однако в режиме удалённого приложения (RemoteApp) работа СЗД не гарантируется, поскольку запуск RemoteApp может (в зависимости от настроек режима удалённого приложения) блокировать окна СЗД.\n\n        ']","
        Нет, На компьютере, на котором планируется работа по сканированию и загрузке документов, должна быть установлена операционная система 
        Cистема Windows, поддерживающая .NET Framework 4.5:
            Windows 7 Service Pack 1;
            Windows Vista Service Pack 2,
            Windows 8, 
            Windows 8.1, 
            Windows Server 2008 SP2, 
            Windows Server 2012
        Полный перечень технически требований, предъявляемых платформой .NET Framework 4.5, приведён на странице Microsoft:
        http://www.microsoft.com/ru-RU/download/details.aspx?id=30653

        ","Вы не предоставили достаточно информации для ответа на ваш вопрос. Пожалуйста, уточните, какой именно функционал вы хотите узнать о ""Скан-Архиве"" на Linux.",7.850707993042515e-232
