question,contexts,ground_truth,answer
Что делает Дозор?,"['Программный продукт «Дозор. Мониторинг систем безопасности рабочей станции» (далее – ПП) предназначен для автоматизации мониторинга состояния безопасности рабочих станций путём контроля установки и настройки антивирусной защиты, доступа к запрещенным сайтам, а также проведение сканирования и отображение информации об установленном программном обеспечении.']","«Дозор. Мониторинг систем безопасности рабочей станции» предназначен для автоматизации мониторинга состояния безопасности рабочих станций путём контроля установки и настройки антивирусной защиты, доступа к запрещенным сайтам, а также проведение сканирования и отображение информации об установленном программном обеспечении.","Программный продукт ""Дозор"" предназначен для автоматизации мониторинга систем безопасности рабочих станций, включая контроль установки и настройки антивирусной защиты, ограничение доступа к запрещенным сайтам, сканирование и отображение информации об установленном программном обеспечении."
Какие модули включает в себя продукт Дозор?,"[' \n        ПП включает в себя три модуля, обладающих следующими функциями:\n•\tМодуль проверки антивирусной защиты ПК:\no\tАвтоматическое формирование перечня установленных на рабочей станции антивирусных программ (пакетов).\no\tАвтоматическое определение и отображение каждой установленной антивирусной программы (пакета).\n•\tМодуль проверки доступа к запрещённым сайтам:\no\tПроверка наличия доступа к интернет-ресурсам, содержащим информацию, запрещённую к распространению в образовательных организациях (далее – «запрещённые интернет-ресурсы»), с текущей рабочей станции.\no\tНастройка параметров проверки:\n\uf0a7\tРасписание проверки: временные интервалы проверки в течение дня, периодичность повторных проверок.\n\uf0a7\tСкорость проверки: низкая, средняя, высокая.\n\uf0a7\tЗадержка между проверками сайтов (в секундах).\no\tЕсли проверка была прервана (например, рабочая станция была выключена до окончания проверки доступности всех интернет-ресурсов из списка), при следующем запуске проверка возобновляется с той позиции в списке, на которой был прерван предыдущий сеанс.\no\tФормирование отчётности о результатах проверки доступа к запрещённым интернет-ресурсам: \n\uf0a7\tСводный отчёт - включает информацию об общем количестве ресурсов в перечне, количестве проверенных ресурсов и количестве доступных интернет-ресурсов из перечня.\n\uf0a7\tДетализированный отчёт – включает перечень всех запрещённых интернет-ресурсов. Для каждого ресурса выводится его доменное имя, дата и время проверки, результат проверки (доступен или не доступен).\no\tСохранение детализированного отчёта в файл в формате CSV.\no\tАвтоматическое обновление перечня запрещённых интернет-ресурсов.\n•\tМодуль проверки программного обеспечения (далее - ПО) на доверие: \no\tПоиск и отображение установленного ПО на ПК пользователя и неизвестного информационной базе ПП.\no\tОтображение пользователю списка, установленного ПО на персональном компьютере пользователя, с известной информацией о них с базы ПП.\no\tВозможность отправки скорректированной записи ПО на рассмотрение оператору по внесению изменений в запись.\no\tВозможность сортировки списков: \n\uf0a7\tПо наименованию ПО.\n\uf0a7\tПо доверию.\no\tОтображение информации о версии используемой информационной базы ПП.\no\tВыгрузка отчетности по ПО, установленному на персональном компьютере пользователя, в формате CSV.\no\tАвтоматизированная загрузка с сервера актуальной базы ПО.\no\tПредоставление вместе с ПП списка базового ПО с дополнительной информацией по программным средствам (может использоваться при запуске программы без Интернет-соединения).\no\tВозможность сокрытия модулей программы через Настройки. \n\u2003\n']","Модуль проверки антивирусной защиты ПК, модуль проверки доступа к запрещённым сайтам,  модуль проверки программного обеспечения (далее - ПО) на доверие","Продукт ""Дозор"" включает в себя три модуля:
1. Модуль проверки антивирусной защиты ПК
2. Модуль проверки доступа к запрещенным сайтам
3. Модуль проверки программного обеспечения (по на доверие)"
Хватит 4 гб оперативки для использования продука Дозор?,"['\n    2\tТехнические требования\nОперационная система\nWindows, поддерживающая .NET 5: \n•\tWindows 10\n\nLinux, поддерживающая .NET 5: \n•\tAlt Linux Рабочая станция 9\n•\tAlt Linux Рабочая станция 10\n•\tAlt Linux Образование 9\n•\tAlt Linux Образование 10\n•\tASTRA LINUX COMMON EDITION РЕЛИЗ «ОРЕЛ»\nПроцессор: \nот 1 ГГц\nОперативная память\nРекомендуемый объём ОЗУ: 8 Гб.\nЖесткий диск\nдля установки и работы ПП требуется наличие свободного места размером не менее 300 МБ на диске.\nНаличие доступа в Интернет:\nДля обновления информационных баз, используемых ПП, и их последующей проверки требуется интернет-соединение со скоростью от 64 Кбит/сек.\nДля установки и настройки ПП компьютер должен быть оснащён манипулятором «мышь».\n\n    ']",Нет. Для работы программного продукат дозор рекомендуется использовать минимум 8Гб ОЗУ. ,"Для использования программного продукта ""Дозор"" рекомендуется иметь объем оперативной памяти не менее 8 Гб. Таким образом, 4 Гб оперативки могут быть недостаточными для работы с данным продуктом."
Сколько весит Дозор?,"['\n    2\tТехнические требования\nОперационная система\nWindows, поддерживающая .NET 5: \n•\tWindows 10\n\nLinux, поддерживающая .NET 5: \n•\tAlt Linux Рабочая станция 9\n•\tAlt Linux Рабочая станция 10\n•\tAlt Linux Образование 9\n•\tAlt Linux Образование 10\n•\tASTRA LINUX COMMON EDITION РЕЛИЗ «ОРЕЛ»\nПроцессор: \nот 1 ГГц\nОперативная память\nРекомендуемый объём ОЗУ: 8 Гб.\nЖесткий диск\nдля установки и работы ПП требуется наличие свободного места размером не менее 300 МБ на диске.\nНаличие доступа в Интернет:\nДля обновления информационных баз, используемых ПП, и их последующей проверки требуется интернет-соединение со скоростью от 64 Кбит/сек.\nДля установки и настройки ПП компьютер должен быть оснащён манипулятором «мышь».\n\n    ']",Для установки и работы ПП Дозор требуется наличие свободного места размером не менее 300 МБ на диске.,"Я не знаю, сколько весит программный продукт ""Дозор""."
Почему не обновляются информационные базы в  Дозор?,"['\n    2\tТехнические требования\nОперационная система\nWindows, поддерживающая .NET 5: \n•\tWindows 10\n\nLinux, поддерживающая .NET 5: \n•\tAlt Linux Рабочая станция 9\n•\tAlt Linux Рабочая станция 10\n•\tAlt Linux Образование 9\n•\tAlt Linux Образование 10\n•\tASTRA LINUX COMMON EDITION РЕЛИЗ «ОРЕЛ»\nПроцессор: \nот 1 ГГц\nОперативная память\nРекомендуемый объём ОЗУ: 8 Гб.\nЖесткий диск\nдля установки и работы ПП требуется наличие свободного места размером не менее 300 МБ на диске.\nНаличие доступа в Интернет:\nДля обновления информационных баз, используемых ПП, и их последующей проверки требуется интернет-соединение со скоростью от 64 Кбит/сек.\nДля установки и настройки ПП компьютер должен быть оснащён манипулятором «мышь».\n\n    ']","Для обновления информационных баз, используемых ПП, и их последующей проверки требуется интернет-соединение со скоростью от 64 Кбит/сек.",Информационные базы в Дозор не обновляются из-за необходимости интернет-соединения со скоростью от 64 Кбит/сек для обновления и последующей проверки баз данных.
Как установить дозор на macos?,"['\n    2\tТехнические требования\nОперационная система\nWindows, поддерживающая .NET 5: \n•\tWindows 10\n\nLinux, поддерживающая .NET 5: \n•\tAlt Linux Рабочая станция 9\n•\tAlt Linux Рабочая станция 10\n•\tAlt Linux Образование 9\n•\tAlt Linux Образование 10\n•\tASTRA LINUX COMMON EDITION РЕЛИЗ «ОРЕЛ»\nПроцессор: \nот 1 ГГц\nОперативная память\nРекомендуемый объём ОЗУ: 8 Гб.\nЖесткий диск\nдля установки и работы ПП требуется наличие свободного места размером не менее 300 МБ на диске.\nНаличие доступа в Интернет:\nДля обновления информационных баз, используемых ПП, и их последующей проверки требуется интернет-соединение со скоростью от 64 Кбит/сек.\nДля установки и настройки ПП компьютер должен быть оснащён манипулятором «мышь».\n\n    ']","К сожалению вы не сможете установить ПП Дозор на устройство с оп MacOS, поддерживаемые опреационные системы: 
        Операционная система Windows, поддерживающая .NET 5: 
            •	Windows 10

        Linux, поддерживающая .NET 5: 
        •	Alt Linux Рабочая станция 9
        •	Alt Linux Рабочая станция 10
        •	Alt Linux Образование 9
        •	Alt Linux Образование 10
        •	ASTRA LINUX COMMON EDITION РЕЛИЗ «ОРЕЛ»
        ","Для установки программного продукта ""Дозор. Мониторинг систем безопасности рабочей станции"" на macOS необходимо иметь доступную версию для данной операционной системы. Однако, из предоставленной информации не видно, что программа поддерживается на macOS. Для установки на другие операционные системы, такие как Linux, необходимо выполнить установку соответствующей версии программы и следовать указаниям в руководстве пользователя."
Программ дозор лагает !,"['\n    2\tТехнические требования\nОперационная система\nWindows, поддерживающая .NET 5: \n•\tWindows 10\n\nLinux, поддерживающая .NET 5: \n•\tAlt Linux Рабочая станция 9\n•\tAlt Linux Рабочая станция 10\n•\tAlt Linux Образование 9\n•\tAlt Linux Образование 10\n•\tASTRA LINUX COMMON EDITION РЕЛИЗ «ОРЕЛ»\nПроцессор: \nот 1 ГГц\nОперативная память\nРекомендуемый объём ОЗУ: 8 Гб.\nЖесткий диск\nдля установки и работы ПП требуется наличие свободного места размером не менее 300 МБ на диске.\nНаличие доступа в Интернет:\nДля обновления информационных баз, используемых ПП, и их последующей проверки требуется интернет-соединение со скоростью от 64 Кбит/сек.\nДля установки и настройки ПП компьютер должен быть оснащён манипулятором «мышь».\n\n    ']","
        Возможно это связано недостаточностью ресурсов устройства на которой установлена программа. 
        Убедитесь что ваше устройство соответвует техническим требованиям:
        
        Процессор -   от 1 ГГц
        Оперативная памят -  Рекомендуемый объём ОЗУ: 8 Гб.
        Жесткий диск - наличие свободного места размером не менее 300 МБ на диске.
        Наличие доступа в Интернет -  для обновления информационных баз, используемых ПП, и их последующей проверки. 
        ","Проблема с лагами программы ""Дозор"" может возникать из-за несоответствия технических требований программы вашему компьютеру. Рекомендуется убедиться, что ваш компьютер соответствует следующим требованиям: оперативная память не менее 8 Гб, процессор от 1 ГГц, наличие свободного места на жестком диске не менее 300 МБ, наличие интернет-соединения со скоростью не менее 64 Кбит/сек и наличие манипулятора ""мышь"". Если ваш компьютер соответствует этим требованиям, возможно проблема в программе самой по совместимости с вашей операционной системой. В этом случае рекомендуется обратиться к разработчикам программы или к специалистам по технической поддержке для устранения проблемы."
Что я получу после оплаты продукта дозор?,['\n                ПП поставляется в электронном виде и включает в себя следующий набор файлов:\n                    •\tDozor_setup_1.0.0.0.exe  – установщик ПП.\n                    •\tРуководство пользователя (данный документ).\n                Электронная почта для вопросов по продукту: info@cr-obr.ru. \n        '],"
                ПП поставляется в электронном виде и включает в себя следующий набор файлов:
                    •	Dozor_setup_1.0.0.0.exe  – установщик ПП.
                    •	Руководство пользователя (данный документ).
                Также вы можете получить консульатцию - Электронная почта для вопросов по продукту: info@cr-obr.ru. 
        ","После оплаты продукта ""Дозор"" вы получите программный продукт в электронном виде, включающий в себя файлы установки, руководство пользователя и три модуля с функциями мониторинга систем безопасности рабочей станции, проверки антивирусной защиты ПК, проверки доступа к запрещенным сайтам и проверки программного обеспечения на доверие."
Что я получу после оплаты продукта дозор?,['\n                ПП поставляется в электронном виде и включает в себя следующий набор файлов:\n                    •\tDozor_setup_1.0.0.0.exe  – установщик ПП.\n                    •\tРуководство пользователя (данный документ).\n                Электронная почта для вопросов по продукту: info@cr-obr.ru. \n        '],"
                ПП поставляется в электронном виде и включает в себя следующий набор файлов:
                    •	Dozor_setup_1.0.0.0.exe  – установщик ПП.
                    •	Руководство пользователя (данный документ).
                Также вы можете получить консульатцию - Электронная почта для вопросов по продукту: info@cr-obr.ru. 
        ","После оплаты продукта ""Дозор"" вы получите программный продукт в электронном виде, который включает в себя файлы установки, руководство пользователя и три модуля с функциями по проверке антивирусной защиты ПК, доступа к запрещенным сайтам и проверки программного обеспечения на доверие."
Что такое медленные режим проверки в  дозор?,"['\n            При первом запуске программы на каждом компьютере необходимо настроить параметры и расписание проверки. В дальнейшем эти параметры можно изменять только в случае необходимости. \n            Для настройки параметров необходимо в главном окне программы нажать «Настройки». После чего откроется окно настроек.\n            В окне настроек необходимо выбрать один из режимов проверки (по умолчанию - медленный):\n            •\tМедленный – проверка сайтов будет происходить поочередно, время проверки увеличится, нагрузка на сеть и компьютер уменьшится.\n            •\tОбычный – проверка будет происходить по нескольким сайтам одновременно (кол-во одновременно проверяемых сайтов зависит от количества физических ядер процессора), время проверки уменьшится, нагрузка на сеть и компьютер увеличится.\n            •\tБыстрый – проверка будет происходить по нескольким сайтам одновременно (кол-во одновременно проверяемых сайтов равно количеству ядер процессора, умноженному на 4), время проверки уменьшится, нагрузка на сеть и компьютер увеличится.\n\n        ']","
                Медленный режим означает, что проверка сайтов будет происходить поочередно, время проверки увеличится, нагрузка на сеть и компьютер уменьшится.
        ","Медленный режим проверки в программном продукте ""Дозор"" предполагает настройку параметров проверки доступа к запрещённым сайтам, таких как временные интервалы проверки, скорость проверки и задержка между проверками сайтов. Также включает возможность сохранения детализированного отчёта в файл в формате CSV и автоматическое обновление перечня запрещённых интернет-ресурсов."
Что такое обычный  режим проверки в  дозор?,"['\n            При первом запуске программы на каждом компьютере необходимо настроить параметры и расписание проверки. В дальнейшем эти параметры можно изменять только в случае необходимости. \n            Для настройки параметров необходимо в главном окне программы нажать «Настройки». После чего откроется окно настроек.\n            В окне настроек необходимо выбрать один из режимов проверки (по умолчанию - медленный):\n            •\tМедленный – проверка сайтов будет происходить поочередно, время проверки увеличится, нагрузка на сеть и компьютер уменьшится.\n            •\tОбычный – проверка будет происходить по нескольким сайтам одновременно (кол-во одновременно проверяемых сайтов зависит от количества физических ядер процессора), время проверки уменьшится, нагрузка на сеть и компьютер увеличится.\n            •\tБыстрый – проверка будет происходить по нескольким сайтам одновременно (кол-во одновременно проверяемых сайтов равно количеству ядер процессора, умноженному на 4), время проверки уменьшится, нагрузка на сеть и компьютер увеличится.\n\n        ']","
                •	Обычный – проверка будет происходить по нескольким сайтам одновременно (кол-во одновременно проверяемых сайтов зависит от количества физических ядер процессора), время проверки уменьшится, нагрузка на сеть и компьютер увеличится.
        ","Обычный режим проверки в Дозор включает в себя автоматическую проверку антивирусной защиты ПК, проверку доступа к запрещенным сайтам и проверку программного обеспечения на доверие."
Чем медленный режим отличается от быстрого? В дозор? ,"['\n            При первом запуске программы на каждом компьютере необходимо настроить параметры и расписание проверки. В дальнейшем эти параметры можно изменять только в случае необходимости. \n            Для настройки параметров необходимо в главном окне программы нажать «Настройки». После чего откроется окно настроек.\n            В окне настроек необходимо выбрать один из режимов проверки (по умолчанию - медленный):\n            •\tМедленный – проверка сайтов будет происходить поочередно, время проверки увеличится, нагрузка на сеть и компьютер уменьшится.\n            •\tОбычный – проверка будет происходить по нескольким сайтам одновременно (кол-во одновременно проверяемых сайтов зависит от количества физических ядер процессора), время проверки уменьшится, нагрузка на сеть и компьютер увеличится.\n            •\tБыстрый – проверка будет происходить по нескольким сайтам одновременно (кол-во одновременно проверяемых сайтов равно количеству ядер процессора, умноженному на 4), время проверки уменьшится, нагрузка на сеть и компьютер увеличится.\n\n        ']","
               При медленном режиме – проверка сайтов будет происходить поочередно, время проверки увеличится, нагрузка на сеть и компьютер уменьшится,
               В обычном режиме проверка будет происходить по нескольким сайтам одновременно это уменьшит время проверки, но увлеичит нагрузку на сеть компьютера.
        ","Медленный режим проверки сайтов будет происходить поочередно, увеличится время проверки, нагрузка на сеть и компьютер уменьшится. Быстрый режим проверки будет происходить по нескольким сайтам одновременно, время проверки уменьшится, нагрузка на сеть и компьютер увеличится."
Почему при быстром режиме проверки в дозор возрастает нагрузка на сервер?,"['\n            При первом запуске программы на каждом компьютере необходимо настроить параметры и расписание проверки. В дальнейшем эти параметры можно изменять только в случае необходимости. \n            Для настройки параметров необходимо в главном окне программы нажать «Настройки». После чего откроется окно настроек.\n            В окне настроек необходимо выбрать один из режимов проверки (по умолчанию - медленный):\n            •\tМедленный – проверка сайтов будет происходить поочередно, время проверки увеличится, нагрузка на сеть и компьютер уменьшится.\n            •\tОбычный – проверка будет происходить по нескольким сайтам одновременно (кол-во одновременно проверяемых сайтов зависит от количества физических ядер процессора), время проверки уменьшится, нагрузка на сеть и компьютер увеличится.\n            •\tБыстрый – проверка будет происходить по нескольким сайтам одновременно (кол-во одновременно проверяемых сайтов равно количеству ядер процессора, умноженному на 4), время проверки уменьшится, нагрузка на сеть и компьютер увеличится.\n\n        ']","
               	Быстрый – проверка будет происходить по нескольким сайтам одновременно (кол-во одновременно проверяемых сайтов равно количеству ядер процессора, умноженному на 4), время проверки уменьшится, нагрузка на сеть и компьютер увеличится.
                Если хотите уменьшить нагрузку на сеть, выберете обычный или медленный режим.
        ","При быстром режиме проверки в Дозор увеличивается нагрузка на сервер из-за необходимости выполнения большого количества операций проверки антивирусной защиты ПК, проверки доступа к запрещенным сайтам и проверки программного обеспечения на доверие."
Какие параметры настройки  проверки проверки доступа к запрещённым сайтам есть в Дозор ?,"['\n            o\tПроверка наличия доступа к интернет-ресурсам, содержащим информацию, запрещённую к распространению в образовательных организациях (далее – «запрещённые интернет-ресурсы»), с текущей рабочей станции.\n            o\tНастройка параметров проверки:\n            \uf0a7\tРасписание проверки: временные интервалы проверки в течение дня, периодичность повторных проверок.\n            \uf0a7\tСкорость проверки: низкая, средняя, высокая.\n            \uf0a7\tЗадержка между проверками сайтов (в секундах).\n            o\tЕсли проверка была прервана (например, рабочая станция была выключена до окончания проверки доступности всех интернет-ресурсов из списка), при следующем запуске проверка возобновляется с той позиции в списке, на которой был прерван предыдущий сеанс.\n        ']","
        Вы можете настраивать Расписание проверки, Скорость проверки: низкая, средняя, высокая. Задержку между проверками сайтов (в секундах).
        ","Параметры настройки проверки доступа к запрещённым сайтам в программе Дозор включают в себя:
- Общее количество сайтов в списке.
- Количество сайтов из списка, проверенных в текущем сеансе проверки.
- Количество сайтов, проверенных в текущем сеансе и определённых как недоступные.
- Процент недоступных сайтов из общего количества сайтов, проверенных в текущем сеансе."
"У меня прервалась проверка запрещенных сайтов в дозор, как мне восстановить работу ?","['\n            o\tЕсли проверка была прервана (например, рабочая станция была выключена до окончания проверки доступности всех интернет-ресурсов из списка), при следующем запуске проверка возобновляется с той позиции в списке, на которой был прерван предыдущий сеанс.\n        ']","
        Просто запустите проверку повторно. При следующем запуске проверка возобновляется с той позиции в списке, на которой был прерван предыдущий сеанс.
        ","Для восстановления работы проверки запрещенных сайтов в программе Дозор, вам нужно открыть программу, зайти во вкладку ""Запрещенные сайты"" и проверить состояние проверки сайтов. При необходимости, выполните повторную проверку сайтов или проверьте настройки программы, чтобы убедиться, что проверка работает корректно. Если проблема сохраняется, обратитесь за помощью к администратору программы или к технической поддержке."
 Я смогу выгружать отчет по пользователю в Дозор?,"['\n            •\tМодуль проверки ПО на доверие: \n            o\tВыгрузка отчетности по ПО, установленному на персональном компьютере пользователя, в формате CSV.\n        ']","
        Да! Вы можете выгружать отчетности по ПО, установленному на персональном компьютере пользователя, в формате CSV
        ","Да, вы сможете выгружать отчет по пользователям в Дозор. Отчет о результатах проверки запрещенных сайтов формируется в окне ""Отчет"" и сохраняется в формате XLSX и CSV."
 Как посмотреть в дозор колчество недоступных сайтов ?,"['\n            •\tВо вкладке «Запрещенные сайты» (рисунок 9) предоставляется информация о проверке запрещённых сайтов. Отображаются показатели:\n                o\tОбщее количество сайтов в списке.\n                o\tКоличество сайтов из списка, проверенных в текущем сеансе проверки.\n                o\tКоличество сайтов, проверенных в текущем сеансе и определённых как недоступные.\n                o\tПроцент недоступных сайтов из общего количества сайтов, проверенных в текущем сеансе.\n\n        ']","
        Во вкладке «Запрещенные сайты» (рисунок 9) предоставляется информация о проверке запрещённых сайтов.  В том числе информаци о 
        Количестве сайтов, проверенных в текущем сеансе и определённых как недоступные.
        ","Для просмотра количества недоступных сайтов в дозоре необходимо открыть вкладку ""Запрещенные сайты"" в окне программы, где будет предоставлена информация о проверке запрещенных сайтов, включая общее количество сайтов в списке, количество проверенных сайтов в текущем сеансе, количество недоступных сайтов в текущем сеансе и процент недоступных сайтов из общего количества проверенных."
 Где в дозор посмотреть список неизветного ПО устновленного на ПК?,"['\n            •\tВкладка «Программное обеспечение» (рисунок 10) предоставляет информацию по проверке ПО, установленного на рабочей станции. Проверка происходит путем сверки ПО клиента и информационной базой ПО, предоставляемой пользователю с ПП. Модуль предоставляет следующую информацию о ПО:\n            o\tСписок неизвестного ПО, установленного на ПК.\n\n        ']","
        Вкладка  «Программное обеспечение» редоставляет информацию по проверке ПО, установленного на рабочей станции. Проверка происходит путем сверки ПО клиента и информационной базой ПО, предоставляемой пользователю с ПП. 
        ","Чтобы посмотреть список неизвестного ПО, установленного на ПК в программном продукте ""Дозор"", нужно запустить программу под правами администратора и перейти в раздел ""Настройки"". В этом разделе необходимо перейти на вкладку ""Активация"" и нажать кнопку ""Открыть"", чтобы выбрать файл-лицензию, выданную продавцом. После успешной активации вы сможете приступить к работе и просмотреть список установленного ПО."
 Как установить Дозор ?,['\n           Дистрибутив ПП представляет собой файл:\n            •\tДля Linux: Dozor.1.0.0.rpm (для Alt Linux) или Dozor.1.0.0.deb (для Astra Linux) инсталляционный пакет ПП. \n            •\tДля Windows: Dozor_setup_1.0.0.0.exe - инсталляционный пакет ПП. \n            Вместо фрагмента «1.0.0.0» могут стоять другие цифры — они соответствуют номеру релиза ПП.\n            Порядок установки:\n            1.\tЗапустить инсталляционный пакет ПП. При запуске произойдёт стандартный запрос прав администратора. \n\n        '],"
        Запустить инсталляционный пакет ПП. 
        Для Linux: Dozor.1.0.0.rpm (для Alt Linux) или Dozor.1.0.0.deb (для Astra Linux) инсталляционный пакет ПП.
        Для Windows: Dozor_setup_1.0.0.0.exe - инсталляционный пакет ПП. 
        Вместо фрагмента «1.0.0.0» могут стоять другие цифры — они соответствуют номеру релиза ПП.
        
        При запуске произойдёт стандартный запрос прав администратора. 
        ","Для установки программного продукта ""Дозор. Мониторинг систем безопасности рабочей станции"" на компьютере с операционной системой Linux или Windows, поддерживающей .NET 5, необходимо сначала скачать и установить соответствующий файл установки: Dozor.1.0.0.rpm (для Alt Linux) или Dozor.1.0.0.deb (для Astra Linux). Затем следует учитывать технические требования, такие как рекомендуемый объём ОЗУ (8 Гб), наличие свободного места на жестком диске не менее 300 МБ, интернет-соединение со скоростью от 64 Кбит/сек для обновления информационных баз, а также наличие манипулятора ""мышь"" для установки и настройки программы."
 Как активировать лицензию Дозор ?,"['\n       1.1\tЗапуск и активация программного продукта на Windows\n        После установки ПП на компьютер – рабочую станцию, необходимо запустить ПП.\n        Запуск ПП осуществляется с помощью файла запуска:\n        После запуска отобразится окно с модулями программы и рабочими данными в них, при условии, что уже был указан путь к действительной лицензии ПП. В ином случае необходимо выполнить активацию ПП, указав путь к файлу с действительной лицензией. \n        Активация выполняется в окне «Настройки», переход в которое осуществляется из главного окна ПП (рисунок 5).\n        При нажатии кнопки «Настройки» откроется окно «Настройки» (рисунок 6).\n        В окне «Настройки» необходимо перейти на вкладку «Активация» и нажать кнопку «Открыть» (рисунок 7).\n        После нажатия кнопки «Открыть», откроется окно выбора файла (рисунок 8), здесь необходимо выбрать файл-лицензию, выданную продавцом. \n        При соблюдении всех шагов данной инструкции, активация завершится успешно, и вы сможете приступить к работе. \n\n        ']","
        1. После установки ПП на компьютер – рабочую станцию, необходимо запустить ПП.
        2. После запуска отобразится окно с модулями программы и рабочими данными в них, при условии, что уже был указан путь к действительной лицензии ПП. В ином случае необходимо выполнить активацию ПП, указав путь к файлу с действительной лицензией. 
        
        Как указать путь к лиценции:
        1. Перейдите в окно «Настройки», переход в которое осуществляется из главного окна ПП. 
        2. В окне «Настройки» необходимо перейти на вкладку «Активация» и нажать кнопку «Открыть» 
        3. После нажатия кнопки «Открыть», откроется окно выбора файла (рисунок 8), здесь необходимо выбрать файл-лицензию, выданную продавцом. 
        При соблюдении всех шагов данной инструкции, активация завершится успешно, и вы сможете приступить к работе. 
        ","Для активации лицензии Dozor необходимо открыть окно ""Настройки"", перейти на вкладку ""Активация"" и нажать кнопку ""Открыть"", после чего выбрать файл-лицензию, выданную продавцом."
"что такое сзд, в скан-архив",['\n        •\t«Скан-Загрузка документов» (СЗД) — программный продукт «Скан-Загрузка документов».\n                    '],"
             СЗД - программный продукт «Скан-Загрузка документов».
        ","СЗД (Скан-Загрузка документов) - программный продукт, предназначенный для автоматизации загрузки данных из печатных документов в базу 1С:Предприятие 8."
"что такое БРС, в скан-архив","['\n        •\tБаза регистрации сканов (БРС) — информационная база 1С, предназначенная для хранения информации об обработанных сканах. Используется в случае если СЗД работает без СА, и есть необходимость хранить обработанные сканы с привязкой к созданным документам\n                    ']","
             БРС - информационная база 1С, предназначенная для хранения информации об обработанных сканах. Используется в случае если СЗД работает без СА, и есть необходимость хранить обработанные сканы с привязкой к созданным документам
        ","БРС (База регистрации сканов) - информационная база 1С, предназначенная для хранения информации об обработанных сканах. Используется в случае если СЗД работает без СА, и есть необходимость хранить обработанные сканы с привязкой к созданным документам."
"Нужно ли покупать несколько лицензий для разных рабочих мест , в скан-архив ","['\n        \n       Для работы в терминальном режиме с N рабочих мест, также необходимо приобрести N лицензий на рабочие места.\n       Приобретаемая лицензия не накладывает ограничений на режим работы с СЗД. Например, вы можете установить и активировать СЗД для работы в локальном режиме, а затем выполнить переактивацию и перенести СЗД на другое рабочее место для работы в локальном или терминальном режиме. В пределах срока действия лицензии вы можете переносить СЗД с одного рабочего места на другое рабочее место (с изменением или с сохранением режима работы) неограниченное число раз, при этом:\n\n        •\tПри таком переносе вы теряете право использования СЗД на старом рабочем месте.\n        •\tПроцедура переноса требует деактивации СЗД на старом рабочем месте и активации на новом.\n        \n        •\tПеренос лицензии на новое рабочее место возможен не ранее чем через 3 рабочих дня после активации на предыдущем рабочем месте.\n        Порядок действий при активации «Скан-Загрузки документов» для разных вариантов лицензирования описан в настоящем «Руководстве» в параграфе «Активация программных компонент» на стр. 15.\n\n                    ']","
        Для работы в терминальном режиме с N рабочих мест, также необходимо приобрести N лицензий на рабочие места.
        ","Да, для использования программного продукта ""Скан-Архив"" необходимо приобретать отдельные лицензии, которые могут быть интегрированы с программным продуктом ""Скан-Загрузка документов""."
как установть скан-архив в  меню «Сервис» ,"['\n        Запуск обработки пользователем выполняется стандартным способом, через список дополнительных отчётов:\n\n        •\tВ обычном режиме – через меню «Сервис» / «Дополнительные отчеты и обработки» /\n        «Дополнительные внешние обработки».\n        \n        •\tВ управляемом режиме — через команду «Дополнительные отчёты» в подразделе «Отчеты» в тех разделах, в которых администратор разместил отчёт. При первом запуске необходимо нажать гиперссылку «Настроить список» в нижней части окна со списком дополнительных отчётов и добавить отчёт «Подсчет количества документов» в список».\n\n        ']","
        Запуск обработки пользователем выполняется стандартным способом, через список дополнительных отчётов:

        •	В обычном режиме – через меню «Сервис» / «Дополнительные отчеты и обработки» /
        «Дополнительные внешние обработки».

        ","Для установки скан-архива в меню ""Сервис"" необходимо выполнить активацию программных компонент. Для этого нужно запустить учетную базу, открыть обработку СЗД и следовать инструкциям по вводу необходимых данных. После этого необходимо отправить запрос на активацию по электронной почте на адрес sa@gendalf.ru и сохранить полученный активационный ключ (License.xml). Этот ключ имеет ограниченный срок годности - 3 дня. После успешной активации скан-архив будет доступен в меню ""Сервис""."
Что означает не исправлять суммы при распознавании в скан архив. ,['\n        Флажок «Не исправлять суммы при распознавании» отключает выполняемый по умолчанию автоматический пересчёт сумм в документе при обработка отсканированного документа. Подробнее см. в «Проверка и дополнение данных» \n        '],"
        Флажок «Не исправлять суммы при распознавании» отключает выполняемый по умолчанию автоматический пересчёт сумм в документе при обработка отсканированного документа.

        ","Не исправлять суммы при распознавании в скан архив означает, что программа не будет автоматически исправлять или изменять суммы в документах при их сканировании и распознавании данных."
Как не учитывать НДС при создании документа в скан-архив. ,"['\n       •\tФлажок «Не учитывать НДС при создании документа» устанавливает режим, при котором в загружаемых документах по умолчанию устанавливается режим учёта без НДС. Этот режим удобен для организаций, работающих без НДС, чьи поставщики предоставляют документы с НДС.\n        ']","
        Для настройки параметров надо в форме обработки нажать «Настройки» в верхнем правом углу обработки и выбрать пункт меню «Настройка параметров обработки»
        Флажок «Не исправлять суммы при распознавании» отключает выполняемый по умолчанию автоматический пересчёт сумм в документе при обработка отсканированного документа.

        ","Для того чтобы не учитывать НДС при создании документа в скан-архиве, необходимо просто не указывать стоимость с НДС при загрузке данных из печатного документа в базу 1С:Предприятие 8 с помощью программного продукта ""Скан-Загрузка документов""."
"У нас разные компании используют разные печатные формы для одних и тех же документов, как это обработать  в скан-архив. ","['\n                4.2\tНастройка правил распознавания\n                Перед началом работы необходимо настроить правила распознавания и обработки сканов, или загрузить уже готовые правила. Эти правила применяются как для загрузки данных из скан-образов (сканированные документы), так и для загрузки данных из табличных документов (формат Excel, OpenDocument, mxl).\n                \n                В поставку СЗД входит файл «ПравилаОбработки.xml», содержащий правила обработки типовых печатных форм «ТОРГ-12», «Счет-фактура» и «Универсальный передаточный документ». Для загрузки готовых правил необходимо нажать кнопку «…» в поле «Правила обработки» и выбрать файл xml, содержащий описание правил.\n\n                Для создания новых правил или изменения существующих правил в подменю «Настройки» выберите пункт меню «Настройка параметров обработки» (см. также следующий параграф).\n\n                Откроется форма для настройки правил. Если файл с правилами не указан, откроется пустая форма (Рис. 21), иначе — форма со списком печатных форм и правил их обработки (Рис. 22).\n\n                \n                Рис. 21\t \n                Рис. 22\n\n                Обратите внимание, что список печатных форм – иерархический, имеет два уровня (Рис. 23). На первом уровне находится название печатной формы – например, «ТОРГ-12». Второй уровень соответствует различным вариантам печатной формы. Такое разделение связано с тем, что одна и та же (с точки зрения учёта) печатная форма у разных организаций (или даже у одной организации, но по различным видам деятельности) может существовать в отличающихся форматах (альбомная или книжная ориентация, разное расположение информационных полей и т.п.). Поэтому распознавание для разных вариантов одной и той же печатной формы может потребовать различных настроек. Правила обработки задаются именно для вариантов печатной формы.\n\n                Для добавления правил обработки   нового типа   печатных   форм   необходимо   нажать кнопку\n                «Добавить».\n\n                Для изменения правил обработки уже имеющейся в списке печатной формы необходимо выбрать в списке нужный вариант печатной формы (т.е. элемент на втором уровне иерархии) и дважды щёлкнуть на нему мышью (Рис. 23).\n\n        ']","
        1. Для создания новых правил или изменения существующих правил в подменю «Настройки» выберите пункт меню «Настройка параметров обработки» 
        2. Откроется форма для настройки правил. Если файл с правилами не указан, откроется пустая форма (Рис. 21), иначе — форма со списком печатных форм и правил их обработки.
        список печатных форм – иерархический, имеет два уровня. На первом уровне находится название печатной формы – например, «ТОРГ-12». Второй уровень соответствует различным вариантам печатной формы. Такое разделение связано с тем, что одна и та же (с точки зрения учёта) печатная форма у разных организаций (или даже у одной организации, но по различным видам деятельности) может существовать в отличающихся форматах (альбомная или книжная ориентация, разное расположение информационных полей и т.п.). Поэтому распознавание для разных вариантов одной и той же печатной формы может потребовать различных настроек. Правила обработки задаются именно для вариантов печатной формы.
        3. Для добавления правил обработки   нового типа   печатных   форм   необходимо   нажать кнопку
        «Добавить».

        ","Для обработки различных печатных форм одних и тех же документов в скан-архиве можно использовать программный продукт ""Скан-Архив"" (СА), который предназначен для автоматизации создания и использования электронного архива скан-копий печатных документов. С помощью этого продукта можно хранить обработанные сканы с привязкой к созданным в базе документам. Если требуется сохранить сканы без использования ""Скан-Архива"", то можно использовать базу регистрации сканов (БРС), которая хранит информацию об обработанных сканах с привязкой к созданным документам. Интеграция ""Скан-Архива"" с программным продуктом ""Скан-Загрузка документов"" (СЗД) описана в соответствующем разделе."
Что за файлы лежат в папке с программой  в скан-архив. ,"['\n            Поставка программы «Скан-Загрузка документов» включает в себя:\n                    •\tВнешние обработки для «1С:Предприятия 8».\n                    o\tСканЗагрузка.epf — основная обработка СЗД.\n                    o\tСканЗагрузка_Фреш.epf — версия обработки для работы в модели сервиса (Фреш).\n                    o\tБРС_ПросмотрСканОбраза.epf — обработка для просмотра сканов, прикреплённых к конкретному документу в базе. Используется при применении режима сохранения обработанных сканов в БРС (см. параграф «6.2.5 Просмотр прикреплённых сканов»).\n                    o\tСЗД_ЖурналОтсканированныхДокументов.epf — обработка для отображения журнала документов с пометками тех, для которых есть прикреплённые сканы. Используется при применении режима сохранения обработанных сканов в БРС (см. параграф «6.2.6 Просмотр журнала документов»).\n                    •\tБРС.dt — выгрузка базы регистрации сканов (БРС). Используется при применении режима сохранения обработанных сканов в БРС (см. параграф «6.2 Сохранение сканов в БРС»).\n                    •\tПрограммные компоненты.\n                    •\tДанное руководство пользователя.\n                    •\tФайл «ПравилаОбработки.xml» с настройками правил обработки типовых регламентированных форм (ТОРГ-12, счёт-фактура, УПД).\n                    •\tПримеры файлов для загрузки (сканы и файлы в табличном формате MS Excel и Open Office / Libre Office).\n        ']","
        Поставляются файлы:
                    •	Внешние обработки для «1С:Предприятия 8».
                        o	СканЗагрузка.epf — основная обработка СЗД.
                        o	СканЗагрузка_Фреш.epf — версия обработки для работы в модели сервиса (Фреш).
                        o	БРС_ПросмотрСканОбраза.epf — обработка для просмотра сканов, прикреплённых к конкретному документу в базе. Используется при применении режима сохранения обработанных сканов в БРС (см. параграф «6.2.5 Просмотр прикреплённых сканов»).
                        o	СЗД_ЖурналОтсканированныхДокументов.epf — обработка для отображения журнала документов с пометками тех, для которых есть прикреплённые сканы. Используется при применении режима сохранения обработанных сканов в БРС (см. параграф «6.2.6 Просмотр журнала документов»).
                    •	БРС.dt — выгрузка базы регистрации сканов (БРС). Используется при применении режима сохранения обработанных сканов в БРС (см. параграф «6.2 Сохранение сканов в БРС»).
                    •	Программные компоненты.
                    •	Данное руководство пользователя.
                    •	Файл «ПравилаОбработки.xml» с настройками правил обработки типовых регламентированных форм (ТОРГ-12, счёт-фактура, УПД).
                    •	Примеры файлов для загрузки (сканы и файлы в табличном формате MS Excel и Open Office / Libre Office).

        ","В папке с программой ""Скан-Архив"" лежат два файла с расширениями dbf и cdx."
Я смогу запустить скан-архив на linux ?,"['\n            Операционная система\n            На компьютере, на котором планируется работа по сканированию и загрузке документов, должна быть установлена операционная система Windows, поддерживающая .NET Framework 4.5: Windows 7 Service Pack 1; Windows Vista Service Pack 2, Windows 8, Windows 8.1, Windows Server 2008 SP2, Windows Server 2012. Полный перечень технически требований, предъявляемых платформой .NET Framework 4.5, приведён на странице Microsoft:\n            http://www.microsoft.com/ru-RU/download/details.aspx?id=30653\n\n            СЗД позволяет работать с базой в режиме удалённого подключения (Remote Desktop). Однако в режиме удалённого приложения (RemoteApp) работа СЗД не гарантируется, поскольку запуск RemoteApp может (в зависимости от настроек режима удалённого приложения) блокировать окна СЗД.\n\n        ']","
        Нет, На компьютере, на котором планируется работа по сканированию и загрузке документов, должна быть установлена операционная система 
        Cистема Windows, поддерживающая .NET Framework 4.5:
            Windows 7 Service Pack 1;
            Windows Vista Service Pack 2,
            Windows 8, 
            Windows 8.1, 
            Windows Server 2008 SP2, 
            Windows Server 2012
        Полный перечень технически требований, предъявляемых платформой .NET Framework 4.5, приведён на странице Microsoft:
        http://www.microsoft.com/ru-RU/download/details.aspx?id=30653

        ","Да, вы сможете запустить скан-архив на Linux, так как информация не указывает ограничений операционной системы для работы с программным продуктом ""Скан-Архив""."
Что такое гендальф хранитель ?,"['\n            Данная программа предназначена для автоматического архивирования (создания резервных копий) данных по указанному пользователем расписанию.\n            «Хранитель V» автоматически запускается при включении компьютера и архивирует файлы, для которых подошел срок архивирования. Для каждого набора файлов программа хранит несколько архивных копий, что позволяет предотвратить потерю данных при возникновении сбоев в процессе работы. При раскрытии архива в непустой каталог существующие в каталоге файлы автоматически архивируются, поэтому после раскрытия архива существует возможность «отката» к исходным данным.\n            «Хранитель V» использует встроенную процедуру архивирования, полностью совместимую с PKZIP/WINZIP, и не требует внешнего архиватора.\n\n        ']","
        Данная программа предназначена для автоматического архивирования (создания резервных копий) данных по указанному пользователем расписанию.
        «Хранитель V» автоматически запускается при включении компьютера и архивирует файлы, для которых подошел срок архивирования. Для каждого набора файлов программа хранит несколько архивных копий, что позволяет предотвратить потерю данных при возникновении сбоев в процессе работы. При раскрытии архива в непустой каталог существующие в каталоге файлы автоматически архивируются, поэтому после раскрытия архива существует возможность «отката» к исходным данным.
        «Хранитель V» использует встроенную процедуру архивирования, полностью совместимую с PKZIP/WINZIP, и не требует внешнего архиватора.

        ","Гэндальф Хранитель - это программа автоматического архивирования данных по указанному пользователем расписанию. Она создает резервные копии файлов на основе заданных параметров, что помогает предотвратить потерю данных при сбоях в работе компьютера."
Чем гендальф хранитель  отличается от Дозор?,"['\n        «Хранитель V» позволяет организовать создание резервных копий данных даже для непрофессиональных пользователей. Пользователям-профессионалам «Хранитель V» помогает автоматизировать регулярное архивирование большого количества данных по гибкому расписанию.\n        «Дозор. Мониторинг систем безопасности рабочей станции» предназначен для автоматизации мониторинга состояния безопасности рабочих станций путём контроля установки и настройки антивирусной защиты, доступа к запрещенным сайтам, а также проведение сканирования и отображение информации об установленном программном обеспечении.\n        ']","
        Хранитель позволяет организовать создание резервных копий данных. «Дозор. Мониторинг систем безопасности рабочей станции» предназначен для автоматизации мониторинга состояния рабочих станций путём контроля установки и настройки антивирусной защиты, доступа к запрещенным сайтам, а также проведение сканирования и отображение информации об установленном программном обеспечении.
        ","Гэндальф Хранитель отличается от Дозор в том, что Гэндальф Хранитель предназначен для автоматического архивирования данных по расписанию, в то время как Дозор не имеет описания или упоминания в данном контексте."
Чем гендальф хранитель совместим с WinZip ?,"['\n        Технические характеристики: \n•\tпрограмма использует встроенную процедуру архивирования, полностью совместимую с PKZIP/PKUNZIP/WinZip. \n\n        ']","
       Да, программа использует встроенную процедуру архивирования, полностью совместимую с PKZIP/PKUNZIP/WinZip. 
        ","Гэндальф Хранитель совместим с WinZip и PKZIP, так как использует встроенную процедуру архивирования, которая полностью совместима с ними, и не требует внешнего архиватора."
А можно архивировать базы 1С:Предприятия  в архиваторе?,"['\n•\tДля архивирования информационных баз 1С:Предприятия, размещёнными на сервере MS SQL Server (реализовано только в «Хранителе V для сервера») на компьютере должна быть установлена поддержка механизма SQL-DMO. Для этого надо при установке «Хранителя V для сервера» на этот компьютер в диалоге инсталлятора «Выбор дополнительных действий» отметить флажок «Установить поддержку SQL-DMO».\n        ']","
       Да, Для архивирования информационных баз 1С:Предприятия, размещёнными на сервере MS SQL Server (реализовано только в «Хранителе V для сервера») на компьютере должна быть установлена поддержка механизма SQL-DMO. Для этого надо при установке «Хранителя V для сервера» на этот компьютер в диалоге инсталлятора «Выбор дополнительных действий» отметить флажок «Установить поддержку SQL-DMO».
        ","Да, можно архивировать информационные базы 1С:Предприятия с использованием программы ""Хранитель V"". Для этого необходимо настроить раздел для архивирования данных SQL с помощью Менеджера Хранителя. При создании архива происходит сначала создание архива данных средствами MS SQL Server, а затем сжатие этого архива в zip-архив и его перемещение в каталог архивов. При разархивировании происходит обратный процесс."
Что такое разностные архивы  в архиваторе?,"['\n        Разностные архивы содержат только те файлы, которые изменились с момента создания последнего полного (не разностного) архива. Поэтому для большинства разделов разностные архивы занимают гораздо меньше места на диске, чем полные архивы. \n        ']","
        Разностные архивы содержат только те файлы, которые изменились с момента создания последнего полного (не разностного) архива. Поэтому для большинства разделов разностные архивы занимают гораздо меньше места на диске, чем полные архивы. 
        ","Разностные архивы в архиваторе представляют собой архивы, которые содержат только измененные файлы по сравнению с последним полным архивом. Они позволяют сократить размер создаваемого архива, так как заносят в него только измененные данные. Для восстановления информации из разностного архива необходим также полный архив, на базе которого был создан данный разностный архив. Последовательность архивов, включая полный архив и все созданные на его основе разностные архивы, называется серией."
"Как  скопировать данные, сохраненные ранее в архиве, в каталог с данными.  в архиваторе?","['\n        Раскрыть (развернуть) архив — скопировать данные, сохраненные ранее в архиве, в каталог с данными. При этом файлы, находившиеся в каталоге данных до раскрытия архива, будут сохранены в резервном архиве и на их место будут записаны данные из раскрываемого архива. \n        ']","
       Вы можете раскрыть (развернуть) архив — скопировать данные, сохраненные ранее в архиве, в каталог с данными. При этом файлы, находившиеся в каталоге данных до раскрытия архива, будут сохранены в резервном архиве и на их место будут записаны данные из раскрываемого архива. 
        ","Для скопирования данных, сохраненных ранее в архиве, в каталог с данными в архиваторе ""Хранитель V"" необходимо запустить Менеджер Хранителя, после чего при раскрытии архива в непустой каталог существующие файлы автоматически архивируются, что позволяет сохранить данные из раскрываемого архива в указанный каталог."
"Можно ли как то указать какие файлы архивировать, а какие нет  в архиваторе?","['\n        Шаблон (набор масок файлов) — фильтр для архивирования файлов. Задавая шаблон, Вы указываете, какие файлы из каталога данных следует заносить в архив. Например, если Вы зададите маску *.docx, то в архив будут занесены только файлы с расширением docx (т.е. файлы Word). Для того чтобы в архив заносились все файлы, расположенные в каталоге данных, можно указать шаблон *.*. Кроме того, Вы можете установить и маски для файлов, которые не надо архивировать. Например, если Вы укажете маску файлов, исключаемых из архивирования, «1Cv8tmp.*», то файлы, имена которых начинаются с «1Cv8tmp» (временные файлы базы 1С:Предприятие) не будут заноситься в архив. \n        ']","
     Да, вы можете задать шаблон, наобор масок файлов это — фильтр для архивирования файлов. Задавая шаблон, Вы указываете, какие файлы из каталога данных следует заносить в архив. Например, если Вы зададите маску *.docx, то в архив будут занесены только файлы с расширением docx (т.е. файлы Word). Для того чтобы в архив заносились все файлы, расположенные в каталоге данных, можно указать шаблон *.*. Кроме того, Вы можете установить и маски для файлов, которые не надо архивировать. Например, если Вы укажете маску файлов, исключаемых из архивирования, «1Cv8tmp.*», то файлы, имена которых начинаются с «1Cv8tmp» (временные файлы базы 1С:Предприятие) не будут заноситься в архив. 
        ","Да, можно указать какие файлы архивировать и какие не архивировать в архиваторе, используя шаблоны и маски файлов. В случае возникновения сообщения ""Нечего архивировать..."" необходимо убедиться, что правильно указан шаблон для архивирования, что файлы не были удалены или перемещены, а также что каталог данных доступен по сети."
"Как сделать так, чтобы данные архивировались в определенное время.","['\n        Как сделать так, чтобы данные архивировались в определенное время.\n        Войдите в свойства раздела (команда «Параметры» в меню «Разделы»), на странице «Расписание» в списке «Время архивирования» выберите «В указанное время» и укажите требуемое время начала автоматического архивирования. \n        ']","
     Войдите в свойства раздела (команда «Параметры» в меню «Разделы»), на странице «Расписание» в списке «Время архивирования» выберите «В указанное время» и укажите требуемое время начала автоматического архивирования. 
        ","Для того чтобы данные архивировались в определенное время, необходимо настроить расписание автоматического архивирования для соответствующего раздела в программе ""Хранитель V"". На странице ""Расписание"" в параметрах раздела установите флажок ""Производить автоматическое архивирование"" и укажите дни и время, когда должно происходить автоархивирование."
"Что делать, если при архивировании выдается сообщение «Файлы раздела ... заблокированы и не могут быть помещены в архив». В архиваторе","['\n        Что делать, если при архивировании выдается сообщение «Файлы раздела ... заблокированы и не могут быть помещены в архив».\nЭто сообщение означает, что какое-то другое приложение («1С:Предприятие» или MS Office) открыло файл в монопольном режиме и «Хранитель V» не может занести этот файл в архив. Рекомендуется прервать архивирование, выйти из программы, которая заблокировала файл и запустить процедуру архивирования повторно.\n\n        ']","
Это сообщение означает, что какое-то другое приложение («1С:Предприятие» или MS Office) открыло файл в монопольном режиме и «Хранитель V» не может занести этот файл в архив. Рекомендуется прервать архивирование, выйти из программы, которая заблокировала файл и запустить процедуру архивирования повторно.
        ","Если при архивировании выдается сообщение «Файлы раздела заблокированы и не могут быть помещены в архив» в архиваторе, то это может быть из-за того, что часть файлов, которые должны попасть в архив, оказались заблокированы. В этом случае, если флажок ""Если целостность нарушена, повторять через ... мин."" включен, то архивирование будет повторяться через указанный интервал времени, который указывается в минутах в поле справа на странице опции. Эта опция действует только при автоматическом архивировании."
У меня не сохраняется файл с большим именем в архиваторе.,"['\nОграничения.\n«Хранитель V» выполняет запись на CD/DVD в формате, совместимом со стандартом ISO-9660. Поэтому имеются следующие ограничения на имена архивов и каталогов:\n•\tимя каталога не должно содержать больше 8 символов;\n•\tимя файла (включая расширение) не должно содержать больше 31 символа;\n•\tколичество уровней вложенности каталогов не должно превышать 8.\nПрограмма автоматически проверяет пути, указываемые при настройке, на соответствие данным ограничениям. Если путь им не соответствует, то появится предупреждение об этом, и Вы должны будете изменить настройки. Наиболее существенным является ограничение на длину имени файла архива. А поскольку имя архива формируется на основе имени раздела, рекомендуется устанавливать разделам имена, имеющие не более 15 символов.\n\n        ']","

Это связано с тем, что «Хранитель V» выполняет запись на CD/DVD в формате, совместимом со стандартом ISO-9660. Поэтому имеются следующие ограничения на имена архивов и каталогов:
•	имя каталога не должно содержать больше 8 символов;
•	имя файла (включая расширение) не должно содержать больше 31 символа;
•	количество уровней вложенности каталогов не должно превышать 8.
Программа автоматически проверяет пути, указываемые при настройке, на соответствие данным ограничениям. Если путь им не соответствует, то появится предупреждение об этом, и Вы должны будете изменить настройки. Наиболее существенным является ограничение на длину имени файла архива. А поскольку имя архива формируется на основе имени раздела, рекомендуется устанавливать разделам имена, имеющие не более 15 символов.

        ","Возможно, проблема с сохранением файла с большим именем в архиваторе связана с ограничениями на длину имени файла в используемой версии архиватора. В таком случае, рекомендуется переименовать файл в более короткое имя перед сохранением его в архиваторе."
"Как я увижу список файлов в Хранитель архиваторе, которые я архвировал","['\n6.6\tПросмотр содержимого архива\nДля каждого архива, созданного в программе «Хранитель V», существует возможность просмотреть список хранящихся в нем файлов, а также некоторые общие свойства архива. Для этого надо:\n•\tзапустить Менеджер Хранителя;\n•\tвыбрать архив в окне архивов;\n•\tв меню «Архивы» выбрать команду «Просмотр содержимого». \nНа экране появится окно свойств архива. В этом окне отображаются файлы, содержащиеся в архиве. Для разностных архивов отображаются также файлы, которых нет в самом разностном архиве, но которые есть в базовом полном архиве. \n\n        ']","
Для каждого архива, созданного в программе «Хранитель V», существует возможность просмотреть список хранящихся в нем файлов, а также некоторые общие свойства архива. Для этого надо:
•	запустить Менеджер Хранителя;
•	выбрать архив в окне архивов;
•	в меню «Архивы» выбрать команду «Просмотр содержимого». 
На экране появится окно свойств архива. В этом окне отображаются файлы, содержащиеся в архиве. Для разностных архивов отображаются также файлы, которых нет в самом разностном архиве, но которые есть в базовом полном архиве. 

        ","Для того чтобы увидеть список файлов в Хранителе архиваторе, которые вы архивировали, вам нужно запустить Менеджер Хранителя и выбрать нужный архив в окне разделов. Затем в меню ""Действия"" выберите команду ""Просмотр содержимого архива"". После этого появится список хранящихся в архиве файлов."
